compensation,companyID,userID
Aliquam erat volutpat.,47,1
Pellentesque eget nunc.,13,14
Nulla tellus. In sagittis dui vel nisl. Duis ac nibh.,30,18
Nam nulla.,1,40
Praesent blandit lacinia erat. Vestibulum sed magna at nunc commodo placerat.,25,5
"Curabitur in libero ut massa volutpat convallis. Morbi odio odio, elementum eu, interdum eu, tincidunt in, leo.",5,7
Donec ut dolor.,9,27
"Aenean sit amet justo. Morbi ut odio. Cras mi pede, malesuada in, imperdiet et, commodo vulputate, justo.",16,30
Vestibulum ac est lacinia nisi venenatis tristique.,19,24
"Donec ut mauris eget massa tempor convallis. Nulla neque libero, convallis eget, eleifend luctus, ultricies eu, nibh.",22,29
Aenean auctor gravida sem.,42,45
Integer a nibh.,31,13
Suspendisse ornare consequat lectus.,17,10
"Donec semper sapien a libero. Nam dui. Proin leo odio, porttitor id, consequat in, consequat ut, nulla.",2,16
Nulla ac enim.,6,46
Cras non velit nec nisi vulputate nonummy. Maecenas tincidunt lacus at velit. Vivamus vel nulla eget eros elementum pellentesque.,43,47
"Maecenas tristique, est et tempus semper, est quam pharetra magna, ac consequat metus sapien ut nunc. Vestibulum ante ipsum primis in faucibus orci luctus et ultrices posuere cubilia Curae; Mauris viverra diam vitae quam.",12,9
"Cum sociis natoque penatibus et magnis dis parturient montes, nascetur ridiculus mus. Vivamus vestibulum sagittis sapien. Cum sociis natoque penatibus et magnis dis parturient montes, nascetur ridiculus mus.",20,39
"Morbi vel lectus in quam fringilla rhoncus. Mauris enim leo, rhoncus sed, vestibulum sit amet, cursus id, turpis. Integer aliquet, massa id lobortis convallis, tortor risus dapibus augue, vel accumsan tellus nisi eu orci.",23,35
Phasellus id sapien in sapien iaculis congue.,34,49
Pellentesque viverra pede ac diam. Cras pellentesque volutpat dui.,45,4
"Lorem ipsum dolor sit amet, consectetuer adipiscing elit.",14,23
Phasellus in felis.,3,37
In hac habitasse platea dictumst. Maecenas ut massa quis augue luctus tincidunt.,28,22
Vestibulum ante ipsum primis in faucibus orci luctus et ultrices posuere cubilia Curae; Duis faucibus accumsan odio.,27,21
Suspendisse potenti. In eleifend quam a odio.,11,11
Quisque ut erat. Curabitur gravida nisi at nibh. In hac habitasse platea dictumst.,29,17
Etiam faucibus cursus urna. Ut tellus. Nulla ut erat id mauris vulputate elementum.,18,33
Nulla suscipit ligula in lacus. Curabitur at ipsum ac tellus semper interdum. Mauris ullamcorper purus sit amet nulla.,41,43
"Sed sagittis. Nam congue, risus semper porta volutpat, quam pede lobortis ligula, sit amet eleifend pede libero quis orci. Nullam molestie nibh in lectus.",26,8
Pellentesque viverra pede ac diam. Cras pellentesque volutpat dui.,10,36
Aliquam non mauris.,21,44
Sed vel enim sit amet nunc viverra dapibus. Nulla suscipit ligula in lacus. Curabitur at ipsum ac tellus semper interdum.,44,6
Praesent blandit lacinia erat.,37,48
Nam nulla.,36,25
In eleifend quam a odio. In hac habitasse platea dictumst. Maecenas ut massa quis augue luctus tincidunt.,24,42
Maecenas pulvinar lobortis est. Phasellus sit amet erat.,50,41
Suspendisse ornare consequat lectus.,8,12
"Nulla neque libero, convallis eget, eleifend luctus, ultricies eu, nibh. Quisque id justo sit amet sapien dignissim vestibulum.",33,26
Vestibulum rutrum rutrum neque.,35,20
Nullam molestie nibh in lectus. Pellentesque at nulla.,32,34
Aenean auctor gravida sem. Praesent id massa id nisl venenatis lacinia. Aenean sit amet justo.,40,38
"Mauris enim leo, rhoncus sed, vestibulum sit amet, cursus id, turpis. Integer aliquet, massa id lobortis convallis, tortor risus dapibus augue, vel accumsan tellus nisi eu orci. Mauris lacinia sapien quis libero.",7,32
"Morbi porttitor lorem id ligula. Suspendisse ornare consequat lectus. In est risus, auctor sed, tristique in, tempus sit amet, sem.",38,15
Integer tincidunt ante vel ipsum. Praesent blandit lacinia erat.,49,28
Sed ante. Vivamus tortor.,39,19
Vestibulum ante ipsum primis in faucibus orci luctus et ultrices posuere cubilia Curae; Duis faucibus accumsan odio. Curabitur convallis. Duis consequat dui nec nisi volutpat eleifend.,48,2
Nam dui.,15,3
Vestibulum rutrum rutrum neque. Aenean auctor gravida sem.,4,50
"In est risus, auctor sed, tristique in, tempus sit amet, sem. Fusce consequat.",46,31
